山东,青岛市,青岛淞菱科技有限公司,移动互联网,IT技术
山东,青岛市,海尔新模式,电子商务 · O2O,IT技术
山东,青岛市,上海震旦办公自动化销售有限公司,企业服务,IT技术
山东,青岛市,布媒网,移动互联网 · 电子商务,IT技术
山东,青岛市,青岛多芬诺信息安全技术有限公司,信息安全 · 数据服务,IT技术
山东,青岛市,青岛蓝天温室有限公司,企业服务,IT技术
山东,青岛市,青岛韩风网络技术有限公司,移动互联网 · 电子商务,IT技术
山东,青岛市,北京正和岛信息科技有限公司,移动互联网 · 社交网络,IT技术
山东,青岛市,青岛天人环境股份有限公司,其他,其他
山东,青岛市,长沙创居网络科技有限公司,移动互联网 · O2O,IT技术
山东,青岛市,万集融合信息技术（北京）有限公司,移动互联网 · 电子商务,IT技术
山东,青岛市,青岛天地荟食品有限公司,生活服务,生活服务
山东,青岛市,青岛浩海网络科技股份有限公司,硬件,电子制造
山东,青岛市,青岛松立软件信息技术股份有限公司,移动互联网,IT技术
山东,青岛市,海尔日日顺乐家水设备有限公司,生活服务,生活服务
山东,青岛市,青岛钱吧金融信息服务有限公司,金融,金融财经
山东,青岛市,太平洋奥特莱斯商业（青岛）有限公司,企业服务 · 其他,IT技术
山东,青岛市,浙江远图互联科技股份有限公司,移动互联网 · 硬件,"IT技术,电子制造"
山东,青岛市,青岛鼎合瑞国际贸易有限公司,招聘 · 旅游,生活服务
山东,青岛市,青岛睿云博通网络科技有限公司,移动互联网,IT技术
山东,青岛市,青岛彼肯信息技术有限公司,移动互联网 · 招聘,"IT技术,生活服务"
山东,青岛市,青岛货嘀嘀嘀信息科技有限公司,移动互联网 · 金融,"IT技术,金融财经"
山东,青岛市,上海震旦办公自动化销售有限公司青岛分公司,硬件 · 企业服务,"IT技术,电子制造"
山东,青岛市,青岛伟信建设投资集团有限公司,移动互联网 · 电子商务,IT技术
山东,青岛市,北京和创未来网络科技有限公司,电子商务 · 金融,"IT技术,金融财经"
山东,青岛市,青岛捷派网络科技有限公司,移动互联网 · 企业服务,IT技术
山东,青岛市,深圳市昊晨科技开发有限公司青岛分公司,移动互联网 · 电子商务,IT技术
山东,青岛市,北京华旭工程项目管理有限公司,其他,其他
山东,青岛市,青岛纸牌屋网络科技有限公司,移动互联网 · 企业服务,IT技术
山东,青岛市,青岛同创信息科技有限公司,信息安全 · 硬件,"IT技术,电子制造"
山东,青岛市,青岛屈臣氏个人用品商店有限公司中山路分公司,医疗健康 · 生活服务,生活服务
山东,青岛市,明医众禾（北京）科技有限公司,O2O · 医疗健康,"IT技术,生活服务"
山东,青岛市,青岛联信商务咨询有限公司,金融 · 其他,金融财经
