Provience,City,CompanyShortName,IndustryField,Upper class of industry
辽宁,沈阳市,通赢天下（天津）网络科技有限公司,电子商务,IT技术
辽宁,沈阳市,北京盒子鱼教育科技有限公司,移动互联网 · 教育,"IT技术,生活服务"
辽宁,沈阳市,沈阳森通广告传媒有限公司,移动互联网 · 文化娱乐,"IT技术,生活服务"
辽宁,沈阳市,北京合力中税科技发展有限公司,移动互联网,IT技术
辽宁,沈阳市,沈阳房小二信息科技有限公司,文化娱乐,生活服务
辽宁,沈阳市,北京塞瑞斯科技有限公司,移动互联网 · O2O,IT技术
辽宁,沈阳市,郑州信大捷安信息技术股份有限公司,移动互联网 · 信息安全,IT技术
辽宁,沈阳市,东软集团,金融,金融财经
辽宁,沈阳市,北京四维图新科技股份有限公司,移动互联网 · 生活服务,"IT技术,生活服务"
辽宁,沈阳市,南京帆软软件有限公司,数据服务,IT技术
辽宁,沈阳市,北京和勤联创技术有限公司,移动互联网,IT技术
辽宁,沈阳市,东软集团股份有限公司,数据服务 · 广告营销,"IT技术,金融财经"
辽宁,沈阳市,东网科技有限公司,数据服务,IT技术
辽宁,沈阳市,同心医联科技(北京)有限公司,移动互联网 · 医疗健康,"IT技术,生活服务"
辽宁,沈阳市,大成方略纳税人俱乐部股份有限公司,企业服务,IT技术
辽宁,沈阳市,佛山市顺德区碧桂园物业发展有限公司,O2O · 其他,IT技术
辽宁,沈阳市,欢动（北京）科技有限公司,游戏,IT技术
辽宁,沈阳市,天津五八到家生活服务有限公司,O2O · 生活服务,"IT技术,生活服务"
辽宁,沈阳市,北京开科唯识技术有限公司,金融,金融财经
辽宁,沈阳市,沈阳迅云网络科技有限公司,移动互联网 · O2O,IT技术
辽宁,沈阳市,杭州网兰科技有限公司,移动互联网 · O2O,IT技术
辽宁,沈阳市,北大医疗信息技术有限公司,医疗健康,生活服务
辽宁,沈阳市,杏树林信息技术（北京）有限公司,移动互联网 · 医疗健康,"IT技术,生活服务"
辽宁,沈阳市,重庆猪八戒网络有限公司,企业服务 · 电子商务,IT技术
辽宁,沈阳市,沈阳小数科技有限公司,移动互联网 · O2O,IT技术
辽宁,沈阳市,微展世（北京）数字科技有限公司,移动互联网 · 其他,IT技术
辽宁,沈阳市,北京世诚优聘科技发展有限公司,移动互联网 · O2O,IT技术
辽宁,沈阳市,深圳市华傲数据技术有限公司,数据服务,IT技术
辽宁,沈阳市,北京谨豪科技有限公司,移动互联网 · 金融,"IT技术,金融财经"
辽宁,沈阳市,北京东软慧聚信息技术股份有限公司,移动互联网 · 企业服务,IT技术
辽宁,沈阳市,深圳市北纬三十一度科技有限公司,移动互联网,IT技术
辽宁,沈阳市,杭州天丽科技有限公司,移动互联网 · 硬件,"IT技术,电子制造"
辽宁,沈阳市,上海科匠信息科技有限公司,移动互联网,IT技术
辽宁,沈阳市,美团网,移动互联网 · O2O,IT技术
辽宁,沈阳市,湖南省创发科技有限责任公司,移动互联网 · 电子商务,IT技术
辽宁,沈阳市,蚂蚁动力（北京）软件技术开发有限公司沈阳分公司,移动互联网,IT技术
辽宁,沈阳市,长沙创居网络科技有限公司,移动互联网 · O2O,IT技术
辽宁,沈阳市,北京融智兴华科技有限公司,硬件 · 文化娱乐,"电子制造,生活服务"
辽宁,沈阳市,沈阳子介传媒有限公司,O2O,IT技术
辽宁,沈阳市,大连龙采正元信息技术有限公司,移动互联网,IT技术
辽宁,沈阳市,沈阳畅游宝科技有限公司,移动互联网 · 旅游,"IT技术,生活服务"
辽宁,沈阳市,广东网间互联科技有限公司,移动互联网,IT技术
辽宁,沈阳市,客如云科技（北京）股份有限公司沈阳分公司,移动互联网,IT技术
辽宁,沈阳市,北京一猫汽车科技有限公司,电子商务 · O2O,IT技术
辽宁,沈阳市,东软熙康健康科技有限公司,移动互联网 · 医疗健康,"IT技术,生活服务"
辽宁,沈阳市,沈阳美行科技有限公司,移动互联网,IT技术
辽宁,沈阳市,搜狐媒体,移动互联网 · 广告营销,"IT技术,金融财经"
辽宁,沈阳市,北京合力亿捷科技股份有限公司,移动互联网 · 企业服务,IT技术
辽宁,沈阳市,沈阳网之商科技有限公司,电子商务 · 企业服务,IT技术
辽宁,沈阳市,三好在线传媒有限公司,企业服务 · 广告营销,"IT技术,金融财经"
辽宁,沈阳市,杭州溢点信息技术有限公司,移动互联网 · O2O,IT技术
辽宁,沈阳市,武汉天喻教育科技有限公司,移动互联网,IT技术
辽宁,沈阳市,辽宁天之传媒有限公司,移动互联网 · 广告营销,"IT技术,金融财经"
辽宁,沈阳市,数创信息技术(上海)有限公司,移动互联网 · O2O,IT技术
辽宁,沈阳市,北京盛安德科技发展有限公司,移动互联网 · 企业服务,IT技术
辽宁,沈阳市,大连龙图信息技术股份有限公司,电子商务 · 企业服务,IT技术
辽宁,沈阳市,北京和创未来网络科技有限公司,电子商务 · 金融,"IT技术,金融财经"
辽宁,沈阳市,广州海鹚网络科技有限公司,移动互联网,IT技术
辽宁,沈阳市,广州爱立信通讯服务有限公司广州第一分公司,移动互联网,IT技术
辽宁,沈阳市,广东睿哲网络科技有限公司,移动互联网 · 电子商务,IT技术
辽宁,沈阳市,客如云科技（北京）股份有限公司,移动互联网 · O2O,IT技术
辽宁,沈阳市,卡盟联众信息技术(北京)有限公司,电子商务 · O2O,IT技术
辽宁,沈阳市,绥中淘酒汇网络科技有限公司,移动互联网 · 电子商务,IT技术
辽宁,沈阳市,北京世纪好未来教育科技有限公司,移动互联网 · 教育,"IT技术,生活服务"
辽宁,沈阳市,沈阳恒昊互联网络有限公司,移动互联网 · 电子商务,IT技术
辽宁,沈阳市,智能云科信息技术有限公司,移动互联网,IT技术
辽宁,沈阳市,北京苹果知科技有限公司,移动互联网 · 硬件,"IT技术,电子制造"
辽宁,沈阳市,辽宁金麒麟装饰工程有限公司,生活服务 · 分类信息,"IT技术,生活服务"
辽宁,沈阳市,深圳伍壹捌动漫有限公司,移动互联网 · 文化娱乐,"IT技术,生活服务"
辽宁,沈阳市,汉海信息技术（上海）有限公司,电子商务 · O2O,IT技术
辽宁,沈阳市,大连九九可爱科技服务有限公司,移动互联网 · 教育,"IT技术,生活服务"
辽宁,沈阳市,深圳市奇摩计算机有限公司,硬件,电子制造
辽宁,沈阳市,沈阳微忆互动网络科技有限公司,移动互联网 · 其他,IT技术
辽宁,沈阳市,迪岸网络技术（上海）有限公司,广告营销 · 文化娱乐,"金融财经,生活服务"
辽宁,沈阳市,沈阳市尚为科技有限公司,电子商务,IT技术
辽宁,沈阳市,杭州小卡科技有限公司,移动互联网 · O2O,IT技术
辽宁,沈阳市,天脉聚源（北京）传媒科技有限公司,数据服务,IT技术
辽宁,沈阳市,上海趣医网络科技有限公司,移动互联网 · 医疗健康,"IT技术,生活服务"
辽宁,沈阳市,长沙市智为信息技术有限公司,信息安全,IT技术
辽宁,沈阳市,北京友友天宇系统技术有限公司,数据服务,IT技术
辽宁,沈阳市,辽宁众信同行软件开发有限公司,移动互联网,IT技术
辽宁,沈阳市,北京看看车科技有限公司,企业服务,IT技术
辽宁,沈阳市,上海鸿影软件科技有限公司,移动互联网 · 教育,"IT技术,生活服务"
辽宁,沈阳市,北京安码科技有限公司,信息安全,IT技术
辽宁,沈阳市,活力世纪科技（北京）有限公司,移动互联网,IT技术
辽宁,沈阳市,沈阳东泽教育技术有限公司,移动互联网 · 教育,"IT技术,生活服务"
辽宁,沈阳市,罕王实业集团有限公司,移动互联网 · 医疗健康,"IT技术,生活服务"
辽宁,沈阳市,黄包车,移动互联网 · O2O,IT技术
辽宁,沈阳市,辽宁巨全网络发展有限公司,游戏 · 移动互联网,IT技术
辽宁,沈阳市,天维尔信息科技股份有限公司,分类信息 · 其他,IT技术
辽宁,沈阳市,沈阳慧科赢创计算机软件有限公司,移动互联网,IT技术
辽宁,沈阳市,上海镭驰金融信息服务有限公司,金融,金融财经
辽宁,沈阳市,上海欢校信息科技有限公司,电子商务,IT技术
辽宁,沈阳市,南京烽火星空通信发展有限公司,移动互联网 · 信息安全,IT技术
辽宁,沈阳市,沈阳云翼科技有限公司,移动互联网 · 医疗健康,"IT技术,生活服务"
辽宁,沈阳市,上海悦会信息科技有限公司,移动互联网,IT技术
辽宁,沈阳市,辽宁茶乐网电子商务有限公司,电子商务 · O2O,IT技术
辽宁,沈阳市,广州玛瑞商务服务有限公司,医疗健康 · 生活服务,生活服务
辽宁,沈阳市,中商惠民（北京）电子商务有限公司,电子商务,IT技术
辽宁,沈阳市,武汉天喻通讯技术有限公司,移动互联网,IT技术
辽宁,沈阳市,博南石管理咨询（上海）有限公司,企业服务 · 数据服务,IT技术
辽宁,沈阳市,北京瑞泰鸿信科技股份有限公司,电子商务 · 其他,IT技术
辽宁,沈阳市,沈阳示剑网络科技有限公司,移动互联网 · 企业服务,IT技术
辽宁,沈阳市,沈阳维尔盛计算机服务有限公司,移动互联网 · 电子商务,IT技术
辽宁,沈阳市,成都康赛信息技术有限公司,教育 · 数据服务,"IT技术,生活服务"
辽宁,沈阳市,辽宁聚进科技有限公司,移动互联网 · 企业服务,IT技术
辽宁,沈阳市,东软睿道教育信息技术有限公司,移动互联网 · 教育,"IT技术,生活服务"
辽宁,沈阳市,北京外研讯飞教育科技有限公司,教育,生活服务
辽宁,沈阳市,北京合创共成科技有限公司,游戏,IT技术
辽宁,沈阳市,用友超客网络技术有限公司,社交网络,IT技术
辽宁,沈阳市,福建联迪商用设备有限公司,移动互联网 · 硬件,"IT技术,电子制造"
辽宁,沈阳市,心医国际数字医疗系统（大连）有限公司,移动互联网 · 医疗健康,"IT技术,生活服务"
辽宁,沈阳市,好买财富管理股份有限公司,电子商务 · 金融,"IT技术,金融财经"
辽宁,沈阳市,北京方寸屋子投资咨询有限公司,移动互联网 · 金融,"IT技术,金融财经"
辽宁,沈阳市,山景科创网络技术(北京)有限公司,移动互联网 · 分类信息,IT技术
辽宁,沈阳市,广州市连奖网络科技有限公司,移动互联网 · 电子商务,IT技术
辽宁,沈阳市,沈阳小罗潮人网络科技有限公司,文化娱乐 · 电子商务,"IT技术,生活服务"
辽宁,沈阳市,广东奥飞动漫文化股份有限公司,文化娱乐,生活服务
辽宁,沈阳市,沈阳源动力餐饮管理咨询有限公司,电子商务 · 生活服务,"IT技术,生活服务"
辽宁,沈阳市,深圳前海一种生活科技有限公司,移动互联网 · 电子商务,IT技术
辽宁,沈阳市,北京金万维科技有限公司,企业服务,IT技术
辽宁,沈阳市,北京热度文化传媒有限公司,文化娱乐,生活服务
辽宁,沈阳市,瑞庭网络技术（上海）有限公司北京分公司,移动互联网,IT技术
辽宁,沈阳市,北京乐洋昊天科技有限公司,移动互联网 · O2O,IT技术
辽宁,沈阳市,北京中盛鸿科技有限公司,移动互联网 · 文化娱乐,"IT技术,生活服务"
辽宁,沈阳市,奇虎360科技有限公司,移动互联网 · 游戏,IT技术
辽宁,沈阳市,杭州恒生芸泰网络科技有限公司,移动互联网 · 医疗健康,"IT技术,生活服务"
辽宁,沈阳市,壹壹金融信息服务（北京）有限公司,金融,金融财经
辽宁,沈阳市,北京灵雨信息技术有限公司,移动互联网,IT技术
辽宁,沈阳市,沈阳创思佳业科技有限公司,移动互联网,IT技术
辽宁,沈阳市,上海普景信息科技有限公司,移动互联网 · O2O,IT技术
辽宁,沈阳市,大连金慧融智科技有限公司,移动互联网 · 金融,"IT技术,金融财经"
辽宁,沈阳市,上海优向网络科技有限公司,移动互联网,IT技术
辽宁,沈阳市,深圳市壹捌无线科技有限公司,移动互联网,IT技术
辽宁,沈阳市,上海易点时空网络有限公司,移动互联网 · O2O,IT技术
辽宁,沈阳市,辽宁慕课投资有限公司,教育,生活服务
辽宁,沈阳市,沈阳大数据运营有限公司,移动互联网 · 数据服务,IT技术
辽宁,沈阳市,沈阳网安技术有限公司,移动互联网,IT技术
辽宁,沈阳市,东软集团（上海）有限公司,医疗健康 · 数据服务,"IT技术,生活服务"
辽宁,沈阳市,北京中企智导信息技术有限公司,移动互联网,IT技术
辽宁,沈阳市,51健康（上海银路投资管理有限公司）,移动互联网 · 医疗健康,"IT技术,生活服务"
辽宁,沈阳市,医宝信息科技（上海）有限公司,电子商务 · 医疗健康,"IT技术,生活服务"
辽宁,沈阳市,飞利浦医疗（苏州）有限公司沈阳分公司,医疗健康,生活服务
辽宁,沈阳市,沈阳千德易讯网络科技有限公司,移动互联网,IT技术
辽宁,沈阳市,北京中广互动广告有限公司,移动互联网 · 广告营销,"IT技术,金融财经"
辽宁,沈阳市,亿度慧达教育科技（北京）有限公司,移动互联网 · 电子商务,IT技术
辽宁,沈阳市,方正国际软件(北京)有限公司,移动互联网 · 数据服务,IT技术
辽宁,沈阳市,江苏鱼跃医疗设备股份有限公司,医疗健康,生活服务
辽宁,沈阳市,沈阳宅急送快运有限公司,生活服务 · 其他,生活服务
辽宁,沈阳市,沈阳黑胡子科技有限公司,移动互联网 · 金融,"IT技术,金融财经"
辽宁,沈阳市,沈阳艺萨艺术发展有限公司,移动互联网 · 社交网络,IT技术
辽宁,沈阳市,新维集团,电子商务 · O2O,IT技术
辽宁,沈阳市,沈阳麦穗科技有限公司,企业服务 · 教育,"IT技术,生活服务"
辽宁,沈阳市,沈阳盘古网络技术有限公司,移动互联网 · O2O,IT技术
辽宁,沈阳市,上海好义信息科技有限公司,移动互联网 · O2O,IT技术
辽宁,沈阳市,深圳三代人科技有限公司,移动互联网,IT技术
辽宁,沈阳市,易通创新科技（大连）有限公司,移动互联网,IT技术
辽宁,沈阳市,沈阳通用机器人技术股份有限公司,医疗健康 · 其他,生活服务
辽宁,沈阳市,中研沃兮网路科技（上海）有限公司,移动互联网 · 企业服务,IT技术
辽宁,沈阳市,神州优车（天津）有限公司,移动互联网 · 电子商务,IT技术
辽宁,沈阳市,仁科互动（北京）信息科技有限公司,移动互联网 · 数据服务,IT技术
辽宁,沈阳市,杭州动享互联网技术有限公司,移动互联网 · O2O,IT技术
辽宁,沈阳市,聚达人（北京）网络传媒有限公司,移动互联网 · 生活服务,"IT技术,生活服务"
辽宁,沈阳市,通用磨坊贸易（上海）有限公司北京分公司,其他,其他
辽宁,沈阳市,北京饭点科技有限公司,O2O,IT技术
辽宁,沈阳市,大连东软思维科技有限公司,企业服务 · 招聘,"IT技术,生活服务"
辽宁,沈阳市,中国平安保险股份有限公司辽宁分公司,金融 · 招聘,"金融财经,生活服务"
辽宁,沈阳市,车满满（北京）信息技术有限公司,移动互联网,IT技术
辽宁,沈阳市,上海瑞金生物科技有限公司,其他 · 医疗健康,生活服务
辽宁,沈阳市,广东酷配电子商务有限公司,电子商务,IT技术
辽宁,沈阳市,沈阳联脉科技有限公司,移动互联网,IT技术
辽宁,沈阳市,北京南电科技发展有限公司,电子商务 · 数据服务,IT技术
辽宁,沈阳市,辽宁巨全网络发展有限公司,游戏,IT技术
辽宁,沈阳市,Best&nbsp;Insight,移动互联网 · 数据服务,IT技术
辽宁,沈阳市,北京启明星辰信息安全技术有限公司,信息安全,IT技术
辽宁,沈阳市,播美互联科技有限公司,移动互联网 · 医疗健康,"IT技术,生活服务"
辽宁,沈阳市,辽宁逛大集电子商务有限公司,电子商务 · O2O,IT技术
辽宁,沈阳市,沈阳唯酷计算机网络科技有限公司,移动互联网,IT技术
辽宁,沈阳市,北京易智享科技有限公司,移动互联网 · 教育,"IT技术,生活服务"
辽宁,沈阳市,深圳市东祥珠宝有限公司,其他,其他
辽宁,沈阳市,北京市蜜蜂汇金科技有限公司,金融,金融财经
辽宁,沈阳市,北京联想利泰软件有限公司,移动互联网 · 招聘,"IT技术,生活服务"
辽宁,沈阳市,沈阳鸿宇科技有限公司,O2O · 硬件,"IT技术,电子制造"
辽宁,沈阳市,沈阳唯思科技有限公司,移动互联网,IT技术
辽宁,沈阳市,沈阳智测科技有限公司,硬件 · 移动互联网,"IT技术,电子制造"
辽宁,沈阳市,沈阳圆梦科技有限公司,电子商务 · 信息安全,IT技术
辽宁,沈阳市,北京嘉农在线信息技术有限公司,移动互联网 · O2O,IT技术
辽宁,沈阳市,沈阳海风网络科技有限公司,企业服务 · 硬件,"IT技术,电子制造"
辽宁,沈阳市,欢动无限（北京）科技有限公司,移动互联网 · 企业服务,IT技术
辽宁,沈阳市,北京德信德胜科技股份有限公司,企业服务 · 数据服务,IT技术
辽宁,沈阳市,天津五八到家生活服务有限公司,移动互联网 · O2O,IT技术
辽宁,沈阳市,德荣和网络科技有限公司,电子商务 · 广告营销,"IT技术,金融财经"
