北京,北京,武汉极意网络科技有限公司,信息安全 · 数据服务,IT技术
北京,北京,北京大合至悦科技传媒有限公司,移动互联网 · 数据服务,IT技术
北京,北京,北京爱和健康科技有限公司,移动互联网 · 医疗健康,"IT技术,生活服务"
北京,北京,路书（北京）科技有限公司,移动互联网 · 旅游,"IT技术,生活服务"
北京,北京,北京辅力达信息科技有限公司,移动互联网,IT技术
北京,北京,塞纳德（北京）信息技术有限公司,文化娱乐,生活服务
北京,北京,北京凯欣科技有限公司,移动互联网,IT技术
北京,北京,日月同行信息技术（北京）有限公司,移动互联网,IT技术
北京,北京,北京美好年代文化传播有限公司,移动互联网 · 电子商务,IT技术
北京,北京,小麦财富投资管理（北京）有限公司,电子商务 · 金融,"IT技术,金融财经"
北京,北京,北京童立方文化品牌管理有限公司,移动互联网 · 电子商务,IT技术
北京,北京,北京先看网络科技有限公司,文化娱乐,生活服务
北京,北京,北京中电博亚科技有限公司,电子商务 · 游戏,IT技术
北京,北京,北京钱到到金服科技有限公司,移动互联网 · 金融,"IT技术,金融财经"
北京,北京,苏州蜗牛数字科技股份有限公司,移动互联网 · 游戏,IT技术
北京,北京,北京宏运通供应链管理有限公司,电子商务 · O2O,IT技术
北京,北京,方正国际软件有限公司,招聘,生活服务
北京,北京,北京米分贸易有限公司,电子商务 · O2O,IT技术
北京,北京,北京拎克网络科技有限责任公司,移动互联网 · O2O,IT技术
北京,北京,富尔国际资产管理有限公司北京分公司,教育 · 金融,"金融财经,生活服务"
北京,北京,北京艾斯酷科技有限公司,移动互联网 · 教育,"IT技术,生活服务"
北京,北京,北京时代拓灵科技有限公司,移动互联网 · 硬件,"IT技术,电子制造"
北京,北京,北京相遇未名咨询有限公司,移动互联网 · 生活服务,"IT技术,生活服务"
北京,北京,北京乐塔克科技有限公司,数据服务,IT技术
北京,北京,水清木华金种子（北京）科技孵化器有限公司,企业服务,IT技术
北京,北京,期货日报社有限公司,金融 · 其他,金融财经
北京,北京,美丽家（北京）网络科技有限公司,生活服务,生活服务
北京,北京,贵州汉泰投资有限公司,电子商务 · O2O,IT技术
北京,北京,优视科技有限公司,移动互联网,IT技术
北京,北京,北京易快修技术服务有限公司,电子商务 · O2O,IT技术
北京,北京,中国平安保险股份有限公司,金融 · 其他,金融财经
北京,北京,世嘉飒美（北京）科技有限公司,移动互联网 · 游戏,IT技术
北京,北京,北京爱书客科技有限公司,移动互联网 · 文化娱乐,"IT技术,生活服务"
北京,北京,北京文华在线科技发展有限公司,移动互联网 · 教育,"IT技术,生活服务"
北京,北京,北京石器量投科技有限公司,金融,金融财经
北京,北京,华夏汇金资本管理有限公司,移动互联网 · 企业服务,IT技术
北京,北京,北京赛普泰克技术有限公司,企业服务 · 信息安全,IT技术
北京,北京,上海道客网络科技有限公司,企业服务 · 数据服务,IT技术
北京,北京,深圳乐智机器人有限公司,移动互联网 · 教育,"IT技术,生活服务"
北京,北京,北京细刻网络科技有限公司,移动互联网 · 电子商务,IT技术
北京,北京,北京长为科技发展有限公司,移动互联网 · O2O,IT技术
北京,北京,LoopMe Ltd.,移动互联网 · 广告营销,"IT技术,金融财经"
北京,北京,北京星辉点点科技有限公司,移动互联网,IT技术
北京,北京,北京春雨万弘科技有限公司,移动互联网 · 医疗健康,"IT技术,生活服务"
北京,北京,北京和许文化传播有限公司,企业服务,IT技术
北京,北京,北京仁言智科技有限公司,企业服务 · 数据服务,IT技术
北京,北京,上海育创网络科技有限公司,教育 · 数据服务,"IT技术,生活服务"
北京,北京,北京谛纵国际管理咨询有限公司,移动互联网 · 企业服务,IT技术
北京,北京,北京爱乐宝机器人科技有限公司,移动互联网 · 硬件,"IT技术,电子制造"
北京,北京,北京全时频道广告有限公司,移动互联网 · 电子商务,IT技术
北京,北京,北京蜂巢互联科技有限公司,移动互联网 · O2O,IT技术
北京,北京,北京华语时代文化传媒有限公司,社交网络 · 文化娱乐,"IT技术,生活服务"
北京,北京,医天下信息技术（北京）有限公司,移动互联网 · 医疗健康,"IT技术,生活服务"
北京,北京,蓝莓智造（北京）文化传媒有限公司,文化娱乐 · 移动互联网,"IT技术,生活服务"
北京,北京,北京振威展览有限公司,其他,其他
北京,北京,Zuora Inc. (北京祖睿科技）,数据服务,IT技术
北京,北京,北京趣盒子商贸有限公司,电子商务 · 文化娱乐,"IT技术,生活服务"
北京,北京,北京钱景财富投资管理有限公司,金融 · 数据服务,"IT技术,金融财经"
北京,北京,北京意视方略广告有限公司,企业服务 · 广告营销,"IT技术,金融财经"
北京,北京,北京瀚唐联众互联网科技有限公司,O2O · 广告营销,"IT技术,金融财经"
北京,北京,上海艺土界面设计有限公司,移动互联网 · 企业服务,IT技术
北京,北京,北京歌华有线数字媒体有限公司,移动互联网,IT技术
北京,北京,北京华谊兄弟新媒体技术有限公司,移动互联网 · 文化娱乐,"IT技术,生活服务"
北京,北京,北京品途天下科技有限公司,O2O · 移动互联网,IT技术
北京,北京,成都奇鲁科技有限公司,移动互联网,IT技术
北京,北京,万达信息股份有限公司,移动互联网 · 数据服务,IT技术
北京,北京,宜兴大师兄科技有限公司,移动互联网 · O2O,IT技术
北京,北京,上海品而数据科技有限公司,移动互联网 · 金融,"IT技术,金融财经"
北京,北京,北京星言爱普信息技术有限公司,移动互联网 · 社交网络,IT技术
北京,北京,深圳市易讯天空网络技术有限公司,移动互联网 · 电子商务,IT技术
北京,北京,北京新行者国际旅行社有限公司,电子商务 · 旅游,"IT技术,生活服务"
北京,北京,北京幽焱科技有限责任公司,游戏,IT技术
北京,北京,北京美科思远环境科技有限公司,企业服务,IT技术
北京,北京,北京臻域合众广告有限公司,移动互联网 · 游戏,IT技术
北京,北京,上海小净信息科技有限公司,移动互联网 · 生活服务,"IT技术,生活服务"
北京,北京,北京微保科技有限责任公司,金融,金融财经
北京,北京,北京毛豆教育咨询有限公司,教育,生活服务
北京,北京,北京荣鼎汇丰投资管理有限公司,移动互联网 · 金融,"IT技术,金融财经"
北京,北京,北京锐泽整合营销顾问有限公司,移动互联网,IT技术
北京,北京,北京聚能鼎力科技股份有限公司,移动互联网 · 文化娱乐,"IT技术,生活服务"
北京,北京,北京环球医疗救援有限责任公司,医疗健康,生活服务
北京,北京,北京炎炎之星文化传播有限责任公司,文化娱乐,生活服务
北京,北京,北京嘉信福德商贸有限公司,生活服务,生活服务
北京,北京,北京东方红盛国际生物技术有限公司,移动互联网 · 生活服务,"IT技术,生活服务"
北京,北京,南京车易淘网络信息技术有限公司,移动互联网 · 数据服务,IT技术
北京,北京,北京捷通无限科技有限公司,移动互联网 · 电子商务,IT技术
北京,北京,北京海腾时代科技有限公司,移动互联网 · 生活服务,"IT技术,生活服务"
北京,北京,北京众行品牌管理顾问有限公司,企业服务,IT技术
北京,北京,慈铭健康体检管理集团股份有限公司,医疗健康,生活服务
北京,北京,大招（天津）科技有限公司,移动互联网 · 广告营销,"IT技术,金融财经"
北京,北京,深圳工作家网络科技有限公司,移动互联网 · 数据服务,IT技术
北京,北京,中国网,文化娱乐,生活服务
北京,北京,广东航宇卫星科技有限公司,企业服务 · 数据服务,IT技术
北京,北京,北京智芃科技有限公司,移动互联网 · 广告营销,"IT技术,金融财经"
北京,北京,北京三夫户外用品股份有限公司,文化娱乐,生活服务
北京,北京,硅谷（中国）发展有限公司,移动互联网,IT技术
北京,北京,北京枫华草木洗涤用品有限公司,电子商务,IT技术
北京,北京,深圳市凯立德软件技术有限公司,移动互联网,IT技术
北京,北京,百益奥佳（北京）健康科技有限公司,教育 · 医疗健康,生活服务
北京,北京,北京汇智博纳教育科技有限公司,移动互联网 · 教育,"IT技术,生活服务"
北京,北京,鸿深云动（北京）科技有限公司,移动互联网 · 企业服务,IT技术
北京,北京,紫马财富（北京）投资管理有限公司,移动互联网 · 金融,"IT技术,金融财经"
北京,北京,广州海鹚网络科技有限公司,移动互联网,IT技术
北京,北京,上海中谷小金金融信息服务有限公司,金融,金融财经
北京,北京,上海夸氪金融信息服务有限公司,金融,金融财经
北京,北京,指挥家（厦门）智能科技有限公司,其他,其他
北京,北京,北京合创未来科技有限公司,移动互联网 · 硬件,"IT技术,电子制造"
北京,北京,北京融汇金信信息技术有限公司,金融,金融财经
北京,北京,北京金坤科创技术有限公司,移动互联网,IT技术
北京,北京,北京瑞奇融通投资管理有限公司,金融,金融财经
北京,北京,北京阿里宝度科技有限公司,移动互联网 · 电子商务,IT技术
北京,北京,北京云信众成软件技术有限公司,移动互联网,IT技术
北京,北京,北大方正信息产业集团有限公司,数据服务 · 硬件,"IT技术,电子制造"
北京,北京,纬创软件（北京）有限公司武汉分公司,企业服务,IT技术
北京,北京,北京金版柏讯科技发展有限公司,文化娱乐,生活服务
北京,北京,广州市钻石世家珠宝有限公司,电子商务 · 其他,IT技术
北京,北京,一起编,社交网络 · 文化娱乐,"IT技术,生活服务"
北京,北京,北京芯世界社会创新发展中心,其他,其他
北京,北京,北京起步科技有限公司,移动互联网,IT技术
北京,北京,北京露芯化妆品有限公司,其他,其他
北京,北京,北京云贝易租科技有限公司,企业服务 · 金融,"IT技术,金融财经"
北京,北京,北京易为信通科技服务有限公司,O2O,IT技术
北京,北京,深圳福迈斯科技有限公司,移动互联网 · 金融,"IT技术,金融财经"
北京,北京,北京房服社科技有限公司,移动互联网 · 电子商务,IT技术
北京,北京,北京七七美家科技有限公司,电子商务 · 生活服务,"IT技术,生活服务"
北京,北京,北京优客投网络科技有限公司,O2O · 金融,"IT技术,金融财经"
北京,北京,北京春水堂商业连锁有限公司,移动互联网 · 电子商务,IT技术
北京,北京,北京利为汇国际教育科技有限公司,教育,生活服务
北京,北京,北京联合倍全电子商务有限公司,电子商务 · O2O,IT技术
北京,北京,动吧斯博体育文化（北京）有限公司,移动互联网 · 文化娱乐,"IT技术,生活服务"
北京,北京,北京优办信息科技有限公司,移动互联网 · O2O,IT技术
北京,北京,思育云（北京）科技发展有限公司,移动互联网,IT技术
北京,北京,上海汇鲲信息科技有限公司,移动互联网 · 电子商务,IT技术
北京,北京,北京新奥特云视科技有限公司,移动互联网,IT技术
北京,北京,国联资产管理有限公司,金融,金融财经
北京,北京,北京车加科技有限公司,移动互联网,IT技术
北京,北京,北京坚果易购科技有限公司,电子商务 · 教育,"IT技术,生活服务"
北京,北京,新诗信息科技（上海）有限公司,移动互联网 · 文化娱乐,"IT技术,生活服务"
北京,北京,指尖翻动（北京）科技有限公司,移动互联网 · 文化娱乐,"IT技术,生活服务"
北京,北京,北京欢乐英雄科技有限公司,移动互联网,IT技术
北京,北京,Alta Mob,移动互联网,IT技术
北京,北京,北京亚杰商汇咨询有限公司,移动互联网 · 企业服务,IT技术
北京,北京,北京姐优科技有限公司,移动互联网 · 生活服务,"IT技术,生活服务"
北京,北京,斑马骑士（北京）科技有限公司,移动互联网 · 教育,"IT技术,生活服务"
北京,北京,晴云科技有限公司,移动互联网 · 企业服务,IT技术
北京,北京,北京蚂蜂窝网络科技有限公司,移动互联网 · 旅游,"IT技术,生活服务"
北京,北京,北京津发科技股份有限公司,数据服务 · 硬件,"IT技术,电子制造"
北京,北京,杭州全维光电科技有限公司,移动互联网 · 硬件,"IT技术,电子制造"
北京,北京,Preminen,移动互联网 · 金融,"IT技术,金融财经"
北京,北京,江苏品客信息科技有限公司,移动互联网 · 数据服务,IT技术
北京,北京,北京中世华博顾问服务有限公司,企业服务 · 其他,IT技术
北京,北京,北京华兴软通科技有限公司,移动互联网 · 企业服务,IT技术
北京,北京,美屋三六五（天津）科技有限公司,移动互联网 · 企业服务,IT技术
北京,北京,族谱科技（北京）有限公司,移动互联网 · 数据服务,IT技术
北京,北京,云栈科技(北京)有限公司,数据服务,IT技术
北京,北京,博韩伟业（北京）科技有限公司,企业服务,IT技术
北京,北京,北京清大科越科技有限公司,其他,其他
北京,北京,livingsimple,移动互联网 · O2O,IT技术
北京,北京,慧泽恒通（北京）资产管理有限公司,金融,金融财经
北京,北京,北京德普互联科技有限公司,移动互联网 · 企业服务,IT技术
北京,北京,北京今起文化发展有限公司,移动互联网 · 文化娱乐,"IT技术,生活服务"
北京,北京,天津合纵时代科技有限公司,移动互联网 · 文化娱乐,"IT技术,生活服务"
北京,北京,南京婚礼大亨网络科技有限公司,移动互联网 · 电子商务,IT技术
北京,北京,井通（北京）科技有限公司,移动互联网,IT技术
北京,北京,小猪（北京）信息科技有限公司,金融,金融财经
北京,北京,北京苹果知科技有限公司,移动互联网 · 硬件,"IT技术,电子制造"
北京,北京,北京指娱天下网络科技有限公司,游戏 · 其他,IT技术
北京,北京,上海觅邦信息科技有限公司,移动互联网 · 数据服务,IT技术
北京,北京,北京创想天下科技有限公司,电子商务  · 企业服务,IT技术
北京,北京,北京金蝶云创软件技术有限公司,移动互联网,IT技术
北京,北京,北京易云华控技术有限公司,文化娱乐,生活服务
北京,北京,北京汇力凯途科技有限公司,移动互联网,IT技术
北京,北京,北京云赢网络科技有限公司,电子商务,IT技术
北京,北京,北京甜区体育文化发展有限公司,移动互联网 · 文化娱乐,"IT技术,生活服务"
北京,北京,北京艺源酷科技有限公司,文化娱乐 · 生活服务,生活服务
北京,北京,北京卓安信达投资管理服务中心,企业服务 · 金融,"IT技术,金融财经"
北京,北京,北京趣皮士科技有限公司,移动互联网,IT技术
北京,北京,北京奥伯特石油科技有限公司,移动互联网,IT技术
北京,北京,北京新新农人网络科技有限公司,电子商务 · O2O,IT技术
北京,北京,北京科摩多软件开发有限公司,信息安全,IT技术
北京,北京,欢聚时代（多玩YY）,移动互联网,IT技术
北京,北京,北京昂腾科技有限公司,移动互联网,IT技术
北京,北京,北京灵泛涂手科技有限公司,移动互联网 · 社交网络,IT技术
北京,北京,北京山海诚信科技有限公司,移动互联网 · 信息安全,IT技术
北京,北京,亿阳集团股份有限公司,金融 · 数据服务,"IT技术,金融财经"
北京,北京,北京易视互动传媒科技有限公司,文化娱乐,生活服务
北京,北京,广州华多网络科技有限公司,移动互联网 · 教育,"IT技术,生活服务"
北京,北京,红毯科技文化（深圳）有限公司,移动互联网 · 社交网络,IT技术
北京,北京,深圳市快读科技有限公司,移动互联网 · 社交网络,IT技术
北京,北京,北京快乐沃克科技有限公司,企业服务 · 移动互联网,IT技术
北京,北京,上海泽恩实业有限公司,移动互联网 · 医疗健康,"IT技术,生活服务"
北京,北京,智慧足迹数据科技有限公司,数据服务 · 其他,IT技术
北京,北京,中科创新未来教育科技（北京）有限责任公司,教育,生活服务
北京,北京,北京可乐屏科技有限公司,O2O,IT技术
北京,北京,北京嘉纳文化传媒有限公司,游戏,IT技术
北京,北京,北京创行合一规划设计院有限公司,旅游,生活服务
北京,北京,北京朴素磐石投资管理有限公司,金融,金融财经
北京,北京,绿蜘蛛科技有限公司,电子商务,IT技术
北京,北京,大连东明汇科技有限公司,电子商务 · 金融,"IT技术,金融财经"
北京,北京,北京卓研未来信息技术有限公司,移动互联网 · 企业服务,IT技术
北京,北京,上海果燃奇传网络科技有限公司北京分公司,游戏,IT技术
北京,北京,成都医云科技有限公司,社交网络 · 医疗健康,"IT技术,生活服务"
北京,北京,北京崔玉涛儿童健康管理中心有限公司,移动互联网 · 生活服务,"IT技术,生活服务"
北京,北京,北京场地汇信息技术有限公司,移动互联网 · O2O,IT技术
北京,北京,北京华有嘉邦信息科技有限公司,O2O · 生活服务,"IT技术,生活服务"
北京,北京,北京泛宇精泰科技有限公司,O2O · 医疗健康,"IT技术,生活服务"
北京,北京,北京奔跑吧货滴科技有限公司,移动互联网,IT技术
北京,北京,北京闪信奇异科技有限公司,金融,金融财经
北京,北京,中金环球投资基金（北京）有限公司,金融,金融财经
北京,北京,北京云来网络科技有限公司,移动互联网 · O2O,IT技术
北京,北京,深圳市理才网信息技术有限公司,移动互联网 · 企业服务,IT技术
北京,北京,云趣（北京）科技有限公司,移动互联网 · 电子商务,IT技术
北京,北京,绮思妙享（北京）餐饮管理有限公司,生活服务 · 其他,生活服务
北京,北京,北京优森移动互联网科技有限公司,移动互联网,IT技术
北京,北京,北京动力时代资讯有限公司,移动互联网 · 硬件,"IT技术,电子制造"
北京,北京,北京糖游游科技有限公司,移动互联网 · 游戏,IT技术
北京,北京,北京天字门生网络科技有限公司,移动互联网,IT技术
北京,北京,北京逢唐体育文化传媒有限责任公司,文化娱乐,生活服务
北京,北京,北京奇好云趣信息技术有限公司,移动互联网 · 硬件,"IT技术,电子制造"
北京,北京,北京大惠堂科技发展有限公司,移动互联网 · 企业服务,IT技术
北京,北京,北京品冠天成科技有限公司,移动互联网 · 企业服务,IT技术
北京,北京,拉卡拉支付有限公司,金融,金融财经
北京,北京,北京弟傲思时代信息技术有限公司,教育 · 金融,"金融财经,生活服务"
北京,北京,北京思奇阳光科技有限公司,移动互联网 · 电子商务,IT技术
北京,北京,柒艺科技（北京）有限公司,广告营销 · 文化娱乐,"金融财经,生活服务"
北京,北京,天津掌视亿通信息技术有限公司北京分公司,移动互联网 · 文化娱乐,"IT技术,生活服务"
北京,北京,睿峰网云（北京）科技股份有限公司,移动互联网,IT技术
北京,北京,拓尔思信息技术股份有限公司北京分公司,数据服务 · 其他,IT技术
北京,北京,北京深蓝海浪教育咨询有限公司,教育 · O2O,"IT技术,生活服务"
北京,北京,北京线下广告有限公司,移动互联网 · 医疗健康,"IT技术,生活服务"
北京,北京,众为智者国际品牌管理顾问（北京）有限公司,电子商务 · 广告营销,"IT技术,金融财经"
北京,北京,维音数码（上海）有限公司,移动互联网,IT技术
北京,北京,江苏天安智联科技股份有限公司,O2O · 生活服务,"IT技术,生活服务"
北京,北京,北京卓佳广告有限公司,电子商务 · 企业服务,IT技术
北京,北京,北京我爱小城信息科技有限公司,移动互联网,IT技术
北京,北京,北京爱动圈科技有限公司,移动互联网 · O2O,IT技术
北京,北京,果动（北京）网络科技有限公司,O2O,IT技术
北京,北京,南京清科信息科技有限公司,移动互联网 · 数据服务,IT技术
北京,北京,迪希希埃（北京）互联网数据研究中心,企业服务 · 数据服务,IT技术
北京,北京,北京鸿高天地科技有限公司,电子商务 · 广告营销,"IT技术,金融财经"
北京,北京,北京万象新动移动科技有限公司,移动互联网 · 广告营销,"IT技术,金融财经"
北京,北京,万户良方（北京）健康管理有限公司,移动互联网 · 医疗健康,"IT技术,生活服务"
北京,北京,北京千锋互联科技有限公司,移动互联网,IT技术
北京,北京,北京暖流科技有限公司,移动互联网 · 其他,IT技术
北京,北京,深圳凌感风信科技有限公司,移动互联网,IT技术
北京,北京,微课信息技术有限公司,移动互联网 · 电子商务,IT技术
北京,北京,北京中交汇能信息科技有限公司,移动互联网,IT技术
北京,北京,北京北方星贸汽车销售服务有限公司,分类信息 · 招聘,"IT技术,生活服务"
北京,北京,北京艾克艾瑞科技有限公司,移动互联网 · 硬件,"IT技术,电子制造"
北京,北京,撬动信息科技（北京）有限公司,移动互联网 · 电子商务,IT技术
北京,北京,北京野牛科技有限公司,移动互联网,IT技术
北京,北京,北京飞龙杀虫技术开发有限公司,O2O · 生活服务,"IT技术,生活服务"
北京,北京,北京华普众生科技有限公司,医疗健康 · 数据服务,"IT技术,生活服务"
北京,北京,北京四海云医科技有限公司,医疗健康 · 硬件,"电子制造,生活服务"
北京,北京,乐其网络科技有限公司,电子商务,IT技术
北京,北京,北京去骑科技有限公司,移动互联网 · 社交网络,IT技术
北京,北京,北京易达惠众数字科技有限责任公司,金融 · 社交网络,"IT技术,金融财经"
北京,北京,重庆特斯联科技有限公司,移动互联网 · 硬件,"IT技术,电子制造"
北京,北京,普惠财富投资管理(北京)有限公司,金融,金融财经
北京,北京,北京天驶科贸有限责任公司,移动互联网 · 电子商务,IT技术
北京,北京,车托帮（北京）移动科技有限公司,移动互联网 · 生活服务,"IT技术,生活服务"
北京,北京,油联（北京）石油化工有限公司,移动互联网,IT技术
北京,北京,创愿（上海）信息技术有限公司,企业服务 · O2O,IT技术
北京,北京,北京勤诚互动广告有限公司,移动互联网 · 广告营销,"IT技术,金融财经"
北京,北京,北京吾人吾幸文化传媒有限公司,文化娱乐,生活服务
北京,北京,深圳市珍爱网信息技术有限公司,社交网络 · 生活服务,"IT技术,生活服务"
北京,北京,北京两面网络科技有限公司,移动互联网 · 社交网络,IT技术
北京,北京,宛心网络科技（北京）有限公司,移动互联网 · 医疗健康,"IT技术,生活服务"
北京,北京,北京嘉华丽康医疗投资管理有限公司,医疗健康,生活服务
北京,北京,北京九龙蓝海科技有限公司,移动互联网,IT技术
北京,北京,苏州市创蓝海淘网络科技有限公司,移动互联网,IT技术
北京,北京,北京优才创智科技有限公司,教育,生活服务
北京,北京,四川创立信息科技有限责任公司,移动互联网 · 硬件,"IT技术,电子制造"
北京,北京,北京卅思云科技股份有限公司,硬件 · 数据服务,"IT技术,电子制造"
北京,北京,北京酒家世纪传媒技术有限公司,文化娱乐,生活服务
北京,北京,北京少年时代科技有限责任公司,游戏,IT技术
北京,北京,北京爱云路科技有限公司,教育 · 数据服务,"IT技术,生活服务"
北京,北京,零一设计,移动互联网 · 文化娱乐,"IT技术,生活服务"
北京,北京,北京源码资本投资有限公司,移动互联网 · 金融,"IT技术,金融财经"
北京,北京,诸葛天下（北京）信息技术有限公司,电子商务,IT技术
北京,北京,北京号角网络科技有限公司,移动互联网 · 广告营销,"IT技术,金融财经"
北京,北京,深圳市华宇讯科技有限公司,移动互联网 · 电子商务,IT技术
北京,北京,北京博洋智通广告有限公司,移动互联网 · 广告营销,"IT技术,金融财经"
北京,北京,北京捌零年代文化传媒有限公司,移动互联网 · 旅游,"IT技术,生活服务"
北京,北京,深圳拓源天创实业发展有限公司,O2O,IT技术
北京,北京,北京胜市保康生物科技发展有限公司,生活服务 · 医疗健康,生活服务
北京,北京,北京首经技术培训中心,其他,其他
北京,北京,壹号电子商务有限公司,电子商务 · O2O,IT技术
北京,北京,北京马斯特科技有限公司,移动互联网,IT技术
北京,北京,安快创业有限公司,社交网络 · 企业服务,IT技术
