北京,北京,涌泉金服信息技术（北京）有限公司,移动互联网 · 金融,"IT技术,金融财经"
北京,北京,北京世嘉无线娱乐科技有限公司,移动互联网 · 游戏,IT技术
北京,北京,北京运科网络科技有限公司,移动互联网 · O2O,IT技术
北京,北京,广州雅特网络科技有限公司,移动互联网,IT技术
北京,北京,网牛时代（北京）科技有限公司,移动互联网,IT技术
北京,北京,北京嗨学网教育科技有限公司,移动互联网,IT技术
北京,北京,众星北斗（北京）科技发展有限公司,广告营销 · 企业服务,"IT技术,金融财经"
北京,北京,北京中微互动广告传媒有限公司,广告营销,金融财经
北京,北京,北京天之华软件系统技术有限责任公司,数据服务,IT技术
北京,北京,北京新网智创科技有限公司,移动互联网,IT技术
北京,北京,北京易易信息技术有限公司,移动互联网 · O2O,IT技术
北京,北京,北京博众微创网络技术有限公司,移动互联网 · 数据服务,IT技术
北京,北京,北京诚行天下投资咨询有限公司,金融,金融财经
北京,北京,北京同创永益科技发展有限公司,数据服务,IT技术
北京,北京,北京方智,其他,其他
北京,北京,悦康送电子商务科技（北京）有限公司,O2O · 医疗健康,"IT技术,生活服务"
北京,北京,培高（北京）商业连锁有限公司,企业服务 · 其他,IT技术
北京,北京,北京炬鑫网络科技有限公司,移动互联网 · 社交网络,IT技术
北京,北京,纠纠（北京）科技有限公司,移动互联网 · 社交网络,IT技术
北京,北京,北京小两口网络科技有限公司,O2O,IT技术
北京,北京,人民幼禾教育科技有限公司,移动互联网 · 教育,"IT技术,生活服务"
北京,北京,北京升鑫网络科技有限公司,数据服务,IT技术
北京,北京,上海仕韬信息科技有限公司,金融,金融财经
北京,北京,中盛盈创（北京）科技有限公司,移动互联网 · 电子商务,IT技术
北京,北京,稳盛（天津）投资管理有限公司,移动互联网 · 金融,"IT技术,金融财经"
北京,北京,北京东方汇通教育科技有限公司,移动互联网 · 教育,"IT技术,生活服务"
北京,北京,央视国际网络有限公司,移动互联网 · 文化娱乐,"IT技术,生活服务"
北京,北京,七麦科技,移动互联网,IT技术
北京,北京,中组智库（北京）信息技术研究有限公司,移动互联网 · 数据服务,IT技术
北京,北京,东莞市东信网络技术有限公司,移动互联网,IT技术
北京,北京,北京美型家信息技术有限公司,O2O,IT技术
北京,北京,北京易贸昆泰科技有限公司,电子商务,IT技术
北京,北京,北京求之易数据有限公司,文化娱乐,生活服务
北京,北京,北京镭嘉商务服务有限公司,移动互联网 · 电子商务,IT技术
北京,北京,智慧芽信息科技（苏州）有限公司,移动互联网,IT技术
北京,北京,美通云动（北京）科技有限公司,移动互联网 · 电子商务,IT技术
北京,北京,北京网梯科技发展有限公司,移动互联网 · 教育,"IT技术,生活服务"
北京,北京,北京海霖科技有限公司,移动互联网,IT技术
北京,北京,上海妙点网络科技有限公司,移动互联网 · 金融,"IT技术,金融财经"
北京,北京,红岭资本,移动互联网 · 金融,"IT技术,金融财经"
北京,北京,北京正镛信息技术有限公司,信息安全 · 企业服务,IT技术
北京,北京,北京拉丰科技有限责任公司,移动互联网 · O2O,IT技术
北京,北京,北京紫宸正阳科技有限公司,移动互联网 · 医疗健康,"IT技术,生活服务"
北京,北京,北京海迈德科技咨询有限公司,移动互联网 · 医疗健康,"IT技术,生活服务"
北京,北京,北京觉烁科技有限公司,移动互联网,IT技术
北京,北京,北京千丁互联科技有限公司,O2O,IT技术
北京,北京,北京全美汇科技有限公司,移动互联网 · 广告营销,"IT技术,金融财经"
北京,北京,石家庄乐校网络科技有限公司,O2O,IT技术
北京,北京,美丫妈妈（北京）餐饮管理有限公司,O2O,IT技术
北京,北京,指触文化传媒（北京）有限公司,移动互联网 · 文化娱乐,"IT技术,生活服务"
北京,北京,鼎奥（上海）网络科技有限公司,企业服务 · 电子商务,IT技术
北京,北京,北京酷酷跑科技有限公司,移动互联网 · 游戏,IT技术
北京,北京,北京普凯国际酒店管理有限公司,其他,其他
北京,北京,北京锦绣大地电子商务有限公司,电子商务,IT技术
北京,北京,中科方德软件有限公司,移动互联网 · 企业服务,IT技术
北京,北京,杭州兑吧网络科技有限公司,移动互联网,IT技术
北京,北京,北京九章云极科技有限公司,数据服务,IT技术
北京,北京,脉思科技（北京）有限公司,移动互联网 · 硬件,"IT技术,电子制造"
北京,北京,北京融智达管理咨询有限公司,移动互联网 · 电子商务,IT技术
北京,北京,上弦场（北京）教育科技有限公司,O2O · 教育,"IT技术,生活服务"
北京,北京,上海市通乾股份投资有限公司,电子商务 · 文化娱乐,"IT技术,生活服务"
北京,北京,瑞凡特（北京）科技有限公司,移动互联网 · 企业服务,IT技术
北京,北京,南京信通科技有限责任公司,移动互联网 · 教育,"IT技术,生活服务"
北京,北京,北京万象娱通网络科技股份有限公司,移动互联网 · 电子商务,IT技术
北京,北京,品今控股集团,金融 · 其他,金融财经
北京,北京,北京合思信息技术有限公司,移动互联网 · 企业服务,IT技术
北京,北京,北京共享元素文化传媒有限公司,文化娱乐,生活服务
北京,北京,京东商城-云平台-实时计算,移动互联网 · 电子商务,IT技术
北京,北京,北京赢点科技有限公司,移动互联网 · 数据服务,IT技术
北京,北京,北京蓝色光标品牌管理顾问股份有限公司,移动互联网 · 数据服务,IT技术
北京,北京,云量科技（北京）有限责任公司,移动互联网 · 金融,"IT技术,金融财经"
北京,北京,北京英途跨文化交流有限公司,企业服务,IT技术
北京,北京,Paymentwall,企业服务 · 游戏,IT技术
北京,北京,北京艾斯优品文化传媒有限公司,移动互联网 · 社交网络,IT技术
北京,北京,猎豹移动,移动互联网 · 其他,IT技术
北京,北京,北京晶源十方科技有限公司,移动互联网,IT技术
北京,北京,南京联创信息科技有限公司,移动互联网 · 教育,"IT技术,生活服务"
北京,北京,悠季科技有限公司,移动互联网  · 医疗健康,"IT技术,生活服务"
北京,北京,北京派迦科技有限公司,企业服务 · 数据服务,IT技术
北京,北京,中企动力科技股份有限公司,电子商务 · 移动互联网,IT技术
北京,北京,团车互联网信息服务（北京）有限公司,移动互联网 · O2O,IT技术
北京,北京,北京合聚数字技术有限公司,数据服务 · 移动互联网,IT技术
北京,北京,北京天合星联市场顾问有限公司,广告营销 · 文化娱乐,"金融财经,生活服务"
北京,北京,北京小马过河教育科技有限公司,移动互联网 · 教育,"IT技术,生活服务"
北京,北京,华车科技有限公司,数据服务 · 其他,IT技术
北京,北京,北京活动天下网络科技有限公司,移动互联网,IT技术
北京,北京,加减互联（北京）营销有限公司,移动互联网 · 电子商务,IT技术
北京,北京,北京雪人科技有限公司,其他,其他
北京,北京,北京市枫格科技有限公司,移动互联网 · 电子商务,IT技术
北京,北京,北京诺信创联科技有限公司,移动互联网 · 医疗健康,"IT技术,生活服务"
北京,北京,北京昊瑞昌科技有限公司,分类信息 · 其他,IT技术
北京,北京,北京众享云科技有限公司,移动互联网 · 电子商务,IT技术
北京,北京,北京方寸屋子投资咨询有限公司,移动互联网 · 金融,"IT技术,金融财经"
北京,北京,北京朗宥资产管理有限公司,金融,金融财经
北京,北京,伽马射线营销咨询（北京）有限公司,广告营销 · 移动互联网,"IT技术,金融财经"
北京,北京,北京怡生乐居有限公司,电子商务  · 文化娱乐,"IT技术,生活服务"
北京,北京,北京弘润华夏科技有限公司,社交网络 · 文化娱乐,"IT技术,生活服务"
北京,北京,北京永洪商智科技有限公司,移动互联网,IT技术
北京,北京,北京林克艾普科技有限公司,移动互联网 · 数据服务,IT技术
北京,北京,苏州清睿信息技术有限公司,移动互联网 · 教育,"IT技术,生活服务"
北京,北京,北京硅谷动力电子商务有限公司,文化娱乐,生活服务
北京,北京,华兴泛亚投资顾问（北京）有限公司,金融,金融财经
北京,北京,北京豆果扬天网络科技有限公司,移动互联网,IT技术
北京,北京,深圳市星尚天空科技有限公司,移动互联网,IT技术
北京,北京,北京王视界文化传媒有限公司,文化娱乐 · 其他,生活服务
北京,北京,北京小美科技有限公司,移动互联网,IT技术
北京,北京,和光互联（北京）科技有限公司,O2O,IT技术
北京,北京,北京开心麻花演艺经纪有限公司,文化娱乐,生活服务
北京,北京,上海易兑外币兑换有限公司北京分公司,O2O · 金融,"IT技术,金融财经"
北京,北京,北京大上科技有限公司,电子商务 · 硬件,"IT技术,电子制造"
北京,北京,北京懒猫金融信息服务有限公司,金融 · 企业服务,"IT技术,金融财经"
北京,北京,&lt;&lt;国家人文历史&gt;&gt;杂志社有限公司,移动互联网 · 教育,"IT技术,生活服务"
北京,北京,北京飞扬天下网络科技股份有限公司,移动互联网 · 游戏,IT技术
北京,北京,北京喜跃信息科技有限公司,游戏 · 硬件,"IT技术,电子制造"
北京,北京,北京天宇新邦科技发展有限公司,移动互联网 · 游戏,IT技术
北京,北京,北京四部网络科技有限公司,移动互联网 · 医疗健康,"IT技术,生活服务"
北京,北京,北京易维新锐网络科技有限公司,移动互联网 · O2O,IT技术
北京,北京,北京汇智通信息技术有限公司,移动互联网 · 数据服务,IT技术
北京,北京,北京小研网络科技有限公司,教育 · 金融,"金融财经,生活服务"
北京,北京,北京众标网络科技有限公司上海分公司,电子商务 · 企业服务,IT技术
北京,北京,北京互利科技有限公司,企业服务 · 数据服务,IT技术
北京,北京,北京远程睿智商务咨询有限公司,企业服务,IT技术
北京,北京,北京畅易信息科技有限公司,移动互联网 · 社交网络,IT技术
北京,北京,北京喜乐航科技股份有限公司,移动互联网,IT技术
北京,北京,北京宝诚时代科技有限公司,移动互联网 · 金融,"IT技术,金融财经"
北京,北京,北京诚迈科技有限公司,移动互联网,IT技术
北京,北京,北京威斯特曼科技有限公司,企业服务 · 文化娱乐,"IT技术,生活服务"
北京,北京,北京为动而生科技有限公司,移动互联网 · 医疗健康,"IT技术,生活服务"
北京,北京,动次科技,移动互联网 · 医疗健康,"IT技术,生活服务"
北京,北京,红帽软件（北京）有限公司研发分公司,企业服务 · 数据服务,IT技术
北京,北京,中移（杭州）信息技术有限公司,移动互联网,IT技术
北京,北京,广州星志桥信息科技有限公司,移动互联网 · 游戏,IT技术
北京,北京,百纳致远（北京）科技有限公司,移动互联网,IT技术
北京,北京,北京墨凡科技有限公司,O2O · 教育,"IT技术,生活服务"
北京,北京,北京贵谷地科技有限公司,社交网络 · O2O,IT技术
北京,北京,车族网（北京）信息技术有限公司,移动互联网,IT技术
北京,北京,北京源清慧虹信息科技有限公司,信息安全 · 数据服务,IT技术
北京,北京,北京数字天网创新科技有限公司,移动互联网,IT技术
北京,北京,北京中美寰宇科技有限责任公司,电子商务 · 其他,IT技术
北京,北京,北京蛋壳无线科技有限公司,移动互联网 · 社交网络,IT技术
北京,北京,北京法海赋能网络科技有限公司,电子商务 · O2O,IT技术
北京,北京,北京康知天下科技有限公司,移动互联网,IT技术
北京,北京,国新盛华信息技术有限公司,移动互联网 · 数据服务,IT技术
北京,北京,大连海大船舶导航国家工程研究中心有限责任公司北京科技分公司,企业服务 · 数据服务,IT技术
北京,北京,北京市锐智科技发展有限公司,移动互联网,IT技术
北京,北京,北京红云融通技术有限公司,移动互联网 · 文化娱乐,"IT技术,生活服务"
北京,北京,天使帮（北京）创业服务有限公司,企业服务,IT技术
北京,北京,中科点击（北京）科技有限公司,移动互联网 · 数据服务,IT技术
北京,北京,北京华生恒业科技有限公司,医疗健康 · 移动互联网,"IT技术,生活服务"
北京,北京,北京文呈盛世科技有限公司,企业服务 · 广告营销,"IT技术,金融财经"
北京,北京,华韵世纪国际文化传媒（北京）有限公司,移动互联网 · 文化娱乐,"IT技术,生活服务"
北京,北京,北京滚雷电子商务有限公司,电子商务,IT技术
北京,北京,北京悲鸿投资有限公司,移动互联网 · 金融,"IT技术,金融财经"
北京,北京,触景无限科技（北京）有限公司,移动互联网 · 旅游,"IT技术,生活服务"
北京,北京,北京开普互联科技有限公司,数据服务,IT技术
北京,北京,上海师傅王家居用品服务有限公司,电子商务,IT技术
北京,北京,北京善金元科技有限公司,O2O · 移动互联网,IT技术
北京,北京,北京中税税务师事务所有限公司,企业服务 · 金融,"IT技术,金融财经"
北京,北京,维客科技（北京）有限公司,移动互联网 · 招聘,"IT技术,生活服务"
北京,北京,南京易米云通网络科技有限公司,移动互联网,IT技术
北京,北京,北京宠物派科技有限公司,移动互联网 · O2O,IT技术
北京,北京,北京华夏基石企业管理咨询有限公司,移动互联网 · 招聘,"IT技术,生活服务"
北京,北京,美域高（北京）投资咨询有限公司,移动互联网 · 电子商务,IT技术
北京,北京,北京善融科技有限责任公司,移动互联网,IT技术
北京,北京,北京易融德利网络科技有限公司,金融,金融财经
北京,北京,北京大隐鹏锐投资咨询有限公司,金融,金融财经
北京,北京,北京嘉禾影城管理咨询有限公司,生活服务 · 文化娱乐,生活服务
北京,北京,北京亚控科技发展有限公司,移动互联网,IT技术
北京,北京,秉臣科技（北京）有限公司,其他,其他
北京,北京,深圳市赢时胜信息技术股份有限公司,金融,金融财经
北京,北京,北京山海树科技有限公司,移动互联网 · 医疗健康,"IT技术,生活服务"
北京,北京,北京众智优选科技有限公司,社交网络 · 企业服务,IT技术
北京,北京,北京绣虎科技有限责任公司,游戏,IT技术
北京,北京,北京卓越通达科技有限公司,电子商务,IT技术
北京,北京,大连龙图信息技术股份有限公司,电子商务 · 企业服务,IT技术
北京,北京,北京非速搜信息技术有限公司,电子商务 · O2O,IT技术
北京,北京,师徒科技（北京）有限公司,移动互联网,IT技术
北京,北京,北京晒客天地科技有限公司,电子商务,IT技术
北京,北京,哆啦宝（北京）科技有限公司,移动互联网,IT技术
北京,北京,搜知云（北京）教育科技有限公司,移动互联网 · 教育,"IT技术,生活服务"
北京,北京,北京由你国际餐饮管理有限公司,生活服务,生活服务
北京,北京,泊海融诚（北京）科技有限公司,O2O,IT技术
北京,北京,北京正和岛信息科技有限公司,移动互联网 · 社交网络,IT技术
北京,北京,北京优捷信达信息科技有限公司,移动互联网  · 数据服务,IT技术
北京,北京,北京开普互联科技有限公司,企业服务 · 数据服务,IT技术
北京,北京,北京和美康信科技有限公司,移动互联网 · 数据服务,IT技术
北京,北京,北京优贝在线网络科技有限公司,移动互联网 · 社交网络,IT技术
北京,北京,北京奥星吉纳广告有限公司,文化娱乐 · 社交网络,"IT技术,生活服务"
北京,北京,北京圈圈科技有限公司,社交网络 · 文化娱乐,"IT技术,生活服务"
北京,北京,北京开干创业传媒技术有限公司,企业服务 · 广告营销,"IT技术,金融财经"
北京,北京,北京分享时代科技有限公司,游戏,IT技术
北京,北京,Alten Group,硬件,电子制造
北京,北京,北京优视米网络科技有限公司,教育 · 文化娱乐,生活服务
北京,北京,北京果壳宇宙教育科技有限公司,医疗健康 · 数据服务,"IT技术,生活服务"
北京,北京,世纪保险经纪有限公司,移动互联网 · 金融,"IT技术,金融财经"
北京,北京,北京品致互联科技有限公司,移动互联网 · 企业服务,IT技术
北京,北京,博康智能网络科技股份有限公司,移动互联网 · 信息安全,IT技术
北京,北京,北京融易通捷航信息技术有限公司,移动互联网 · 电子商务,IT技术
北京,北京,北京炼石云商网络科技有限公司,电子商务,IT技术
北京,北京,创维集团有限公司,硬件,电子制造
北京,北京,易联汇华（北京）科技有限公司,移动互联网 · 金融,"IT技术,金融财经"
北京,北京,北京易达小鸟科技有限公司,移动互联网 · O2O,IT技术
北京,北京,"Splitforce, Inc.",移动互联网 · 企业服务,IT技术
北京,北京,北京瑞格嘉尚文化传播有限公司,广告营销 · 文化娱乐,"金融财经,生活服务"
北京,北京,北京多采多宜网络科技有限公司,电子商务 · 生活服务,"IT技术,生活服务"
北京,北京,成都梦工厂网络信息有限公司,游戏,IT技术
北京,北京,北京美丽租网络科技有限公司,O2O,IT技术
北京,北京,上海汇翼信息科技有限公司,移动互联网 · 企业服务,IT技术
北京,北京,北京红云融通技术有限公司,企业服务 · 文化娱乐,"IT技术,生活服务"
北京,北京,南京力赢信息科技有限公司,企业服务,IT技术
北京,北京,脉讯在线（北京）信息技术有限公司,移动互联网,IT技术
北京,北京,大唐电信科技股份有限公司,移动互联网 · 游戏,IT技术
北京,北京,Pivotal,数据服务,IT技术
北京,北京,北京源创云网络科技有限公司,移动互联网 · 数据服务,IT技术
北京,北京,深圳市有信网络技术有限公司,移动互联网,IT技术
北京,北京,友乐活（北京）网络科技有限公司,移动互联网 · 医疗健康,"IT技术,生活服务"
北京,北京,北京指百针电子商务有限公司,电子商务 · 教育,"IT技术,生活服务"
北京,北京,瑞得天成文化传播（北京）有限公司,文化娱乐,生活服务
北京,北京,医统天下（北京）网络科技有限公司,电子商务,IT技术
北京,北京,北京英富森软件股份有限公司,移动互联网 · 电子商务,IT技术
北京,北京,北京新知百略科技有限公司,移动互联网 · 社交网络,IT技术
北京,北京,北京慈记网络科技有限公司,移动互联网 · 医疗健康,"IT技术,生活服务"
北京,北京,深圳市美联教育科技有限公司,教育,生活服务
北京,北京,完美世界(北京)网络技术有限公司,移动互联网 · 游戏,IT技术
北京,北京,北京中润无限科技有限公司,移动互联网,IT技术
北京,北京,北京乐融多源信息技术有限公司,金融,金融财经
北京,北京,飞驰镁物（北京）科技有限公司,移动互联网 · 数据服务,IT技术
北京,北京,北京美好明天科技有限公司,移动互联网 · 教育,"IT技术,生活服务"
北京,北京,北京油菜花金融信息服务有限公司,金融,金融财经
北京,北京,上海和辰信息技术有限公司,移动互联网 · 数据服务,IT技术
北京,北京,北京小车匠信息系统有限公司,教育,生活服务
北京,北京,乐约电子科技（上海）有限公司,移动互联网 · 医疗健康,"IT技术,生活服务"
北京,北京,北京畅景立达软件技术有限公司,数据服务 · 文化娱乐,"IT技术,生活服务"
北京,北京,创意树科技（北京）有限公司,O2O · 教育,"IT技术,生活服务"
北京,北京,北京火河科技有限公司,硬件,电子制造
北京,北京,北京环宇盛景体育文化传媒有限公司,文化娱乐,生活服务
北京,北京,北京融保网络技术有限公司,移动互联网 · 电子商务,IT技术
北京,北京,引行金融信息服务（上海）有限公司,移动互联网 · 金融,"IT技术,金融财经"
北京,北京,北京安亿致用科技有限公司,移动互联网,IT技术
北京,北京,北京宇电威达科技发展有限公司,移动互联网,IT技术
北京,北京,北京中教启星科技股份有限公司,移动互联网,IT技术
北京,北京,北京指掌易科技有限公司,移动互联网,IT技术
北京,北京,新湖期货有限公司北京分公司,金融,金融财经
北京,北京,北京小腹肌科技有限公司,移动互联网 · 电子商务,IT技术
北京,北京,北京云觅信息科技有限公司,文化娱乐,生活服务
北京,北京,北京简单科技有限公司,移动互联网 · 教育,"IT技术,生活服务"
北京,北京,环球大数据科技有限公司,移动互联网 · 数据服务,IT技术
北京,北京,睿晟博控（北京）科技有限公司,其他,其他
北京,北京,中国民航信息网络股份有限公司研发中心新分销,移动互联网,IT技术
北京,北京,博科思网络技术（北京）有限公司,医疗健康,生活服务
北京,北京,北京天桐互动信息技术有限公司,移动互联网,IT技术
北京,北京,百度移信网络技术（北京）有限公司,移动互联网,IT技术
北京,北京,爱果实（北京）教育科技有限公司,教育,生活服务
北京,北京,天一星辰（北京）科技有限公司,移动互联网 · 金融,"IT技术,金融财经"
北京,北京,信和财富投资管理（北京）有限公司厦门分公司,企业服务,IT技术
北京,北京,北京聚能创世信息科技有限公司,电子商务 · O2O,IT技术
北京,北京,北京联龙博通电子商务技术有限公司,移动互联网 · 电子商务,IT技术
北京,北京,爱空间科技（北京）有限公司,O2O,IT技术
北京,北京,斯泰克科技股份有限公司,移动互联网,IT技术
北京,北京,《财经》杂志,移动互联网 · 文化娱乐,"IT技术,生活服务"
北京,北京,趣点在线科技（北京）有限公司,O2O,IT技术
北京,北京,嘀一科技（北京）有限公司,移动互联网,IT技术
北京,北京,北京和聚网络科技有限公司,电子商务 · 医疗健康,"IT技术,生活服务"
北京,北京,清青创科技服务股份有限公司,金融,金融财经
北京,北京,收货宝（北京）信息技术有限公司,O2O,IT技术
北京,北京,大牛天下（北京）科技有限公司,移动互联网,IT技术
北京,北京,央广新媒体文化传媒（北京）有限公司,移动互联网 · 文化娱乐,"IT技术,生活服务"
北京,北京,深圳怀新企业投资顾问股份有限公司,金融,金融财经
北京,北京,北京彩易天地科技有限公司,移动互联网,IT技术
北京,北京,北京活琪王投资有限公司,移动互联网 · 金融,"IT技术,金融财经"
北京,北京,北京沃丰时代数据科技有限公司,企业服务 · 数据服务,IT技术
北京,北京,泰达宏利基金管理有限公司,金融,金融财经
北京,北京,天弘基金管理有限公司,金融,金融财经
北京,北京,北京博览众享科技有限公司,社交网络 · 广告营销,"IT技术,金融财经"
北京,北京,阡陌在线（北京）科技发展有限公司,移动互联网 · 旅游,"IT技术,生活服务"
北京,北京,北京运多多网络科技有限公司,电子商务 · 生活服务,"IT技术,生活服务"
北京,北京,北京天神互动科技有限公司,移动互联网 · 游戏,IT技术
北京,北京,北京熙健信息技术有限公司,移动互联网 · 医疗健康,"IT技术,生活服务"
北京,北京,北京爱普之星科技有限公司,移动互联网,IT技术
北京,北京,加和（北京）信息科技有限公司,移动互联网 · 数据服务,IT技术
北京,北京,北京智汇联合科技有限公司,移动互联网 · O2O,IT技术
北京,北京,北京育路互联科技有限公司,移动互联网 · 教育,"IT技术,生活服务"
北京,北京,北京全融信息服务有限公司,金融,金融财经
北京,北京,精益创造团,硬件 · 信息安全,"IT技术,电子制造"
北京,北京,北京艾漫数据股份科技有限公司,移动互联网 · 数据服务,IT技术
北京,北京,不知名投资管理有限公司,电子商务 · 企业服务,IT技术
北京,北京,斧子科技（北京）有限公司,移动互联网,IT技术
北京,北京,北京易卓方登网络科技有限公司,移动互联网 · 游戏,IT技术
北京,北京,悦北商贸（北京）有限责任公司,电子商务 · O2O,IT技术
北京,北京,北京中启智源数字信息技术有限责任公司,电子商务 · 企业服务,IT技术
北京,北京,北京拉手网络技术有限公司,移动互联网 · 电子商务,IT技术
北京,北京,数岩科技（厦门）股份有限公司,其他,其他
北京,北京,北京麦豆米科技有限公司,移动互联网 · O2O,IT技术
